vous tes tellement idiotes! , you are so stupid.
elle cria l aide. , she screamed for help.
je suis certain que tom souffre. , i m sure tom is suffering.
vous me critiquez sans cesse! , you re always criticizing me!
je suis content d tre un homme. , i m glad i m a man.
il est le pr sident du comit. , he s the chairman of the committee.
vous tes tr s l gants. , you re very sophisticated.
je suis pr te si vous l tes. , i m ready if you are.
je suis ta disposition. , i m at your disposal.
il est joueur de tennis. , he s a tennis player.
c est toi la prof. , you re the teacher.
il est vieux et laid. , he s old and ugly.
tu n es pas habill e. , you re not dressed.
tu n es pas rempla able. , you aren t replaceable.
me voil fin pr t. , i m here and ready.
vous tes vraiment splendides. , you re really gorgeous.
elle lui envoya une carte postale. , she sent him a postcard.
je n ai pas peur de vous. , i m not afraid of you.
il est assis en tailleur. , he is sitting cross legged.
je suis diff rente. , i m different.
c est un gentleman. , he s a gentleman.
c est l un de mes voisins. , he is one of my neighbors.
je vais acheter quelque chose tom. , i m going to buy tom something.
elle a l air d tre malade. , she seems to be sick.
je vais jouer au tennis ce soir. , i m going to play tennis this evening.
je suis heureuse moi aussi. , i m happy too.
je suis heureux d tre de retour. , i m happy to be back.
il est ton p re. , he s your father.
je suis touriste. , i am a tourist.
vous n tes pas tr s amusants. , you re not very funny.
tu es toute seule. , you re all alone.
vous tes fort efficace. , you re very efficient.
tu n es pas rationnel. , you re not being rational.
je ne suis pas raciste. , i m not racist.
je suis un peu surpris. , i m kind of surprised.
j ai faim! , i m hungry.
a me pla t beaucoup. , i am very happy with it.
tu es si m chant. , you re so mean.
vous tes tr s observateur. , you re very observant.
j ai peur que ce soit un refus. , i am afraid it is a reject.
elle sourit avec bonheur. , she smiled happily.
tu es en danger. , you re in danger.
je suis vann e. , i m exhausted.
je suis fourbu. , i m very tired.
je lis un livre sur le ski. , i m reading a book about skiing.
vous tes vraiment emb tante. , you re really annoying.
elle m a montr sa chambre. , she showed me her room.
je suis d pourvu de talent. , i m untalented.
je d m nage le mois prochain. , i am moving next month.
je suis d sol ce vol est complet. , i m sorry that flight is full.
elle s assit son c t. , she sat next to him.
tu n es pas habill. , you re not dressed.
tu es inquiet pas vrai? , you re worried aren t you?
je cherche un endroit o vivre. , i m looking for a place to live.
je me fais vieux. , i m getting old.
je doute qu il vienne. , i am doubtful whether he will come.
tu es tellement idiot! , you re such an idiot!
je te vire. , i m firing you.
votre nom m est familier. , i am familiar with your name.
vous ne regardez pas. , you aren t looking.
c est une fille mais elle est brave. , she s a girl but she s brave.
je ne fais pas partie de leur groupe. , i m not one of them.
je suis en sous v tements. , i m in my underwear.
vous avez parfaitement raison. , you re absolutely right.
c est un travailleur appliqu. , he is a hard worker.
t es marrante. , you re fun.
je ne fais que mon devoir. , i m only doing my duty.
t es bourr. , you re loaded.
je ne suis pas si folle. , i m not that crazy.
tu n es plus un b b. , you re not a child anymore.
je suis aussi grande que vous. , i m as tall as you.
je ne suis pas assez bonne pour toi. , i m not good enough for you.
j ai dix huit ans. , i am years old.
vous n tes pas en s curit ici. , you re not safe here.
je suis m ticuleuse. , i m finicky.
il est toujours pr t. , he is always prepared.
je suis agr ablement surpris par cela. , i m pleasantly surprised by that.
je suis tr s flatt d entendre cela. , i m really flattered to hear that.
je ne suis pas une personne violente. , i m not a violent person.
je ne suis pas comme les autres gens. , i m not like other people.
je suis bien consciente des risques. , i m well aware of the risks.
vous tes l de bonne heure ce matin! , you are very early this morning.
je ne reviens pas ici. , i m not coming back here.
vous tes branch es. , you re fashionable.
il dit un mensonge. , he is telling a lie.
il est toujours dans les nuages. , he is always day dreaming.
elle est plus une relation qu une amie. , she is more an acquaintance than a friend.
il est habitu parler en public. , he is used to speaking in public.
c est un ancien d tenu. , he s an ex con.
je vais faire autre chose. , i m going to do something else.
je suis aim de toute ma famille. , i am loved by all my family.
elle a eu du mal se lever. , she struggled to get up.
je suis aussi curieux que toi. , i m as curious as you are.
je suis impatient de vous revoir. , i am looking forward to seeing you again.
vous tes tr s perspicace. , you re very perceptive.
c est une personne fiable. , she is a reliable person.
il se fait vieux. , he s getting old.
il a une mauvaise influence. , he s a bad influence.
je ne suis pas d courag. , i m not discouraged.
je suis si seule. , i m so lonely.
vous tes cr atives. , you re creative.
vous tes fort avis s. , you re very wise.
elle semble tre vraiment malade. , she seems to be very ill.
je n en suis simplement pas s re. , i m just not sure.
je vais nager quotidiennement. , i m going to swim every day.
vous tes tr s direct. , you re very direct.
je ne suis pas fou. , i m not mad.
vous tes fort en col re. , you re very angry.
c est la fille de mes r ves. , she is my dream girl.
motionnellement je suis vid e. , i m emotionally drained.
il est mieux que quiconque. , he is better than anyone else.
je ne passe pas une bonne journ e. , i m not having a good day.
il adore la peinture. , he is fond of painting.
elle est enceinte de jumeaux. , she s pregnant with twins.
vous tes tr s effront s. , you re very forward.
c est un homme de parole. , he is a man of his word.
vous n tes pas encore morts. , you re not dead yet.
je suis s re qu il r ussira. , i am sure of his success.
vous tes bonne cuisini re non? , you are a good cook aren t you?
elle le gronda. , she scolded him.
vous n tes pas juste. , you re not being fair.
vous tes trop bruyante. , you re too loud.
il est en train d arriver. , he s coming.
elle est un tr s bon professeur. , she is a very good teacher.
elle avait h te de le revoir. , she is looking forward to seeing him again.
il agit de son propre chef. , he s acting on his own.
je suis azeri. , i m azerbaijani.
je suis assez fatigu e. , i m quite tired.
tu es un bon journaliste. , you re a good journalist.
je suis riche. , i m rich.
je dis seulement la v rit. , i m only telling the truth.
je suis paresseux. , i am lazy.
je te vire. , i m letting you go.
elle a l esprit ouvert. , she s open minded.
je suis heureux que tu sois l. , i m happy you re here.
j tudie tr s consciencieusement. , i m studying very hard.
je ne suis jamais chez moi le dimanche. , i m never at home on sundays.
vous tes bonnes. , you are good.
j en ai marre de garder des secrets. , i m tired of keeping secrets.
j ai peur de la hauteur. , i m scared of heights.
je suis parfaitement conscient de ce fait. , i m fully aware of that fact.
je ne vais pas t embrasser. , i m not going to kiss you.
je ne suis pas celle que vous pensez. , i m not who you think i am.
il est en tat de choc. , he s in a state of shock.
je n y suis pas hostile. , i m not unsympathetic.
j en ai assez de l entendre. , i m sick of hearing it.
elle est gentille. , she s nice.
elle n a pas tort. , she s got a point.
je suis s r que tout va bien. , i m sure everything s ok.
tu me fais marcher. , you re pulling my leg.
je suis fatigu e de faire la queue. , i m tired of waiting in line.
c est un nouveau venu. , he s a newcomer.
tu n es pas sp cial. , you re not special.
vous tes tr s marrant. , you re very funny.
c est un type trange. , he s a strange guy.
elle a tir avec une arme. , she shot a gun.
je suis disponible maintenant. , i m available now.
elle est coupable de fraude. , she is guilty of fraud.
elle lui serra la main. , she shook hands with him.
j utilise cette tasse. , i m using that cup.
je suis toujours fier de ma famille. , i m always proud of my family.
je n en suis pas s re. , i m not sure about it.
c est une vraie beaut. , she is a real beauty.
vous tes incroyables. , you re amazing.
je suis satisfait de tout. , i m satisfied with everything.
jouer du piano est mon point fort. , i m good at playing the piano.
vous n y tes pas autoris s. , you re not allowed in there.
je ne suis pas vieux. , i m not old.
je suis g de vingt cinq ans. , i m years old.
je suis habitu la situation. , i m familiar with the situation.
je suis un peu fatigu aujourd hui. , i m a little bit tired today.
je suis puissant. , i m powerful.
il est bien connu dans notre pays. , he is well known in our country.
a va merci. , i m fine thank you.
il oublie toujours des choses. , he is always forgetting things.
je suis fatigu e de boston. , i m tired of boston.
je suis riche. , i m wealthy.
vous tes fiables. , you re trustworthy.
je commence m en souvenir. , i am beginning to remember it.
on ne m invite pas aux f tes. , i m not invited to parties.
il projette de lancer son entreprise. , he is planning to launch his business.
a me va. , i m fine with it.
je suis ici pour affaires. , i am here on business.
il est encore en vie. , he s still alive.
je ne porte aucun sous v tement. , i am not wearing any underwear.
c est un fondu de musique. , he is mad about music.
il est trop vieux pour moi. , he s too old for me.
vous tes tellement idiot! , you are so stupid.
je romps ce soir avec ma nana. , i m breaking up with my girlfriend tonight.
elle a dit qu elle avait t heureuse. , she said she had been happy.
vous tes tr s g n reuses. , you re very generous.
c est un sacr musicien. , he is something of a musician.
vous tes veinards. , you re in luck.
vous tes tatillons. , you re finicky.
je m entra ne avec mes amis. , i m training with my friends.
elle est en danger. , she is currently in danger.
je suis accro la t l. , i m a tv addict.
vous allez bien. , you re all right.
je ne suis pas une enfant unique. , i m not an only child.
il est en train de peindre un tableau. , he is painting a picture.
je suis surpris de vous voir. , i m surprised to see you.
je suis tellement fier de toi. , i m so proud of you.
je suis trop vieille pour toi. , i m too old for you.
c est un monsieur. , he is a gentleman among gentlemen.
je pense s rieusement d m nager boston. , i m seriously considering moving to boston.
je ne suis pas convaincu. , i m not persuaded.
c est un professeur de notre cole. , he is a teacher at our school.
je suis sournoise. , i m sneaky.
vous tes productif. , you re productive.
tu n es pas dans ton tat normal. , you re not your normal self.
je suis d j riche. , i m already rich.
vous tes inquiet n est ce pas? , you re worried aren t you?
je n ai pas sommeil. , i m not sleepy.
vous tes des cr tins. , you are morons.
il est grand et mince. , he is tall and lean.
vous n y tes pas en s curit. , you re not safe there.
vous n y tes pas autoris. , you re not allowed in there.
je passe mes vacances la plage. , i m spending my holiday on the beach.
j ai faim. , i m feeling hungry.
tu es tr s observateur. , you re very observant.
il est bon dans ce qu il fait. , he s good at what he does.
elle est habill e l gamment. , she s smartly dressed.
tu es la plus vieille. , you re the oldest.
je suis promue. , i m being promoted.
elle est enceinte. , she s pregnant.
vous tes tr s craintif. , you re very timid.
vous tes fort effront s. , you re very forward.
tu es juste fatigu. , you re just tired.
il est intelligent. , he s intelligent.
vous tes le champion n est ce pas? , you re the champion aren t you?
elle est une artiste n e. , she is a gifted artist.
tu es gentil. , you re kind.
tu es de toute vidence en grande forme. , you re obviously in great shape.
tu es cruel. , you re cruel.
c est un homme mari. , he s a married man.
c est ma camarade de classe. , she s my classmate.
je ne suis pas plus intelligent que lui. , i m not as intelligent as he is.
vous n tes pas malade. , you re not sick.
je songe au projet. , i m thinking of the plan.
c est une fille intelligente et ind pendante. , she s a smart and independent girl.
je suis tr s triste d entendre a. , i m very sad to hear that.
vous tes bonne. , you are good.
je vis avec mes parents. , i m living with my parents.
il a peur de son grand p re. , he is afraid of his grandfather.
elle porte une belle montre. , she is wearing a nice watch.
tu es la meilleure. , you re the greatest.
vous n tes pas en retard. , you re not late.
elle a parl impoliment. , she spoke impolitely.
elle est en r union. , she s at a meeting.
c est un bon gars. , he s a fine young lad.
je suis un clochard bon rien. , i m a good for nothing bum.
il est un danger pour la soci t. , he is a danger to society.
je suis certain. , i am sure.
je suis tr s triste. , i m very sad.
il adore l op ra. , he s an opera lover.
vous tes la plus grande personne ici. , you re the tallest person here.
je vais en europe la semaine prochaine. , i am going to europe next week.
je commence devenir curieuse. , i m beginning to get curious.
je suis si fier de mon quipe. , i m so proud of my team.
je suis ravi de votre travail. , i m very pleased with your work.
vous tes jeune et forte. , you re young and strong.
je suis strict. , i m strict.
vous tes la ma tresse. , you re the master.
elle attend un heureux v nement. , she s pregnant.
il ment mal. , he s a bad liar.
je ne vais pas faire a aujourd hui. , i m not doing that today.
il est accro l h ro. , he s addicted to heroin.
je n carte pas cette possibilit. , i m not discounting that possibility.
je suis videmment tr s d u. , i m obviously very disappointed.
j en ai fini. , i m done with it.
j ai honte de ta conduite. , i am ashamed of your conduct.
vous tes une femme formidable! , you re a wonderful woman.
je suis habitu travailler dur. , i am accustomed to working hard.
c est une femme tranquille. , she is a quiet woman.
je suis fatigu de faire la file. , i m tired of waiting in line.
je suis presque pr te. , i am almost ready.
c est un magnat. , he s a tycoon.
tu n es pas si int ressant. , you re not that interesting.
j attends mon chauffeur. , i m waiting for my driver.
je n en suis pas certain. , i m not sure.
elle porte un chapeau. , she s wearing a hat.
je ne suis pas du tout fatigu. , i m not a bit tired.
je suis musicien. , i m a musician.
en un sens tu as raison. , you are right in a way.
je suis maigrichon. , i m skinny.
tu es une femme tr s attirante. , you re a very attractive woman.
tu n es pas le probl me. , you re not the problem.
elle tricote un chandail. , she is knitting a sweater.
il est indign. , he s outraged.
tu es tr s motive. , you re very emotional.
c est un gar on tr s chouette. , he s a very nice boy.
elle est habitu e se lever t t. , she s accustomed to getting up early.
il est un peu niais. , he s a bit naive.
tu es aveugl e par l amour. , you are blinded by love.
je suis certaine que vos intentions taient bonnes. , i m sure your intentions were good.
c est un tr s chouette gar on. , he s a very nice boy.
il regarde la t l vision. , he is watching tv.
je pars. , i m leaving.
il est content de ses nouvelles chaussures. , he is pleased with his new shoes.
c est un jeune homme intelligent. , he s an intelligent young man.
je suis satisfait des r sultats. , i m satisfied with the results.
je suis tr s occup tom. , i m really busy tom.
vous tes trop maigrichonne. , you re too skinny.
je me fais vieille. , i m getting old.
je m inqui te pour l avenir. , i m worried about the future.
je suis vraiment d sol pour l erreur. , i m very sorry about the mistake.
j ai peur de mourir. , i m afraid of dying.
je suis d u. , i m disappointed.
vous savez vous faire comprendre. , you re assertive.
je suis un joueur de foot. , i m a football player.
je suis un tranger ici. , i am a stranger here.
je perds la t te. , i m in way over my head.
je suis galement pensionn e. , i m retired too.
je suis assise seule chez moi. , i m sitting alone in my house.
je suis juste un monsieur tout le monde. , i am just a nobody.
je crains qu il ne commette une erreur. , i am afraid he will make a mistake.
je suis fort modeste. , i m very modest.
je suis pr t quand tu l es. , i m ready when you are.
je suis quelqu un de bien. , i m a nice guy.
elle est sous la chaise. , she s under the chair.
je commence me languir de ma petite amie. , i m beginning to miss my girlfriend.
je ne suis plus mari e avec tom. , i m not married to tom anymore.
c est un bon docteur. , he is a good doctor.
je suis en retard de quelques minutes. , i m a few minutes late.
je suis ravie de vous voir. , i m delighted to see you.
je suis seulement moi. , i m just being me.
tu es un gar on malin. , you re a smart boy.
tu caches quelque chose. , you re hiding something.
il est forc de remarquer votre erreur. , he s bound to notice your mistake.
je ne suis pas un voleur. , i m not a thief.
il est toujours en train de se plaindre. , he is constantly complaining.
il sait nager comme un poisson. , he is able to swim like a fish.
il vous regarde toujours. , he s always looking at you.
je suis crev e. , i m exhausted.
t es dingue! , you re nuts!
elle a loup le coche. , she s missed the boat.
elle a tellement envie d y aller. , she so wants to go.
elle n est pas infirmi re mais docteur. , she is not a nurse but a doctor.
il est tr s soigneux. , he is very careful.
quelle poisse j ai! , i m so unlucky!
je te donne encore une chance. , i m giving you one more chance.
je suis tout seul dans ce pays tranger. , i am all alone in a foreign country.
je me rends un pic nic demain. , i am going on a picnic tomorrow.
je suis d sol de vous avoir bless. , i m sorry i hurt you.
je ne suis pas tr s bon chanteur. , i m not a very good singer.
je ne suis pas en forme. , i m not in good shape.
je commence me sentir d sesp r. , i m starting to feel desperate.
je suis fatigu de lire. , i m sick and tired of reading.
elle cherche un meilleur emploi. , she s looking for a better job.
je n ai pas termin. , i m not done.
elle est en danger. , she s in danger.
c est vous l enseignant. , you re the teacher.
je pars en turquie demain. , i m off to turkey tomorrow.
je me sens bien. , i m feeling good.
tu n es pas seule. , you re not alone.
je suis d j pratiquement adulte. , i m practically an adult already.
elle est pianiste. , she is a pianist.
je suis ravi que vous ayez pu venir. , i m glad you could make it.
je suis ravi que tu aies soulev cela. , i m glad you brought that up.
vous tes tr s motive. , you re very emotional.
il a peu pr s mon ge. , he is about my age.
je profite de ce temps chaud. , i m enjoying this warm weather.
vous lui faites mal. , you re hurting him.
c est moi qui ai frapp tom. , i m the one who punched tom.
il est obs d par la propret. , he s obsessed with cleanliness.
je ne suis pas d sorganis. , i m not disorganized.
c est toi la plus vieille. , you re the oldest.
je suis drogu. , i m addicted.
je n en suis pas fi re. , i m not proud of that.
tu es pardonn e. , you re forgiven.
il est la recherche d un emploi. , he s looking for a job.
je ne joue plus aux jeux de hasard. , i m not gambling anymore.
je ne suis pas fier de a. , i am not proud of this.
il est plein d nergie. , he is full of energy.
c est moi le patron par ici. , i m the boss around here.
je crains de ne toujours pas comprendre. , i m afraid i still don t understand.
j appelle de mon t l phone cellulaire. , i m calling from my cell phone.
tu es agit. , you re restless.
tu es endormi. , you re sleepy.
elle vient de france. , she is from france.
il est l un des meilleurs. , he s one of the best.
je suis encore sous le choc. , i m still in shock.
j en ai fini avec mes corv es. , i m done with my chores.
je suis allergique au gluten. , i m allergic to gluten.
tu rougis! , you re blushing.
je connais mal les po tes fran ais. , i m not familiar with french poets.
je suis habitu rester debout tard. , i m used to staying up late.
il est dentiste de profession. , he is a dentist by profession.
il n est pas idiot. , he s not stupid.
je viens d angleterre. , i am from england.
je ne suis pas du tout int ress. , i m not interested at all.
elle se tint pr s de lui. , she stood close to him.
il entra ne un cheval pour une course. , he is training a horse for a race.
il n est vraiment pas heureux. , he is far from happy.
elle est inqui te pour sa s curit. , she is anxious about her safety.
tu as le sens de l observation. , you re observant.
tu es plein de ressources. , you re resourceful.
je suis gav. , i m stuffed.
je n ai pas fini. , i m not done.
vous tes tr s talentueuse. , you re very talented.
elle plante des roses dans le jardin. , she s in the garden planting roses.
je me sens un peu fatigu e. , i m feeling kind of tired.
tu ne vas pas assez vite. , you re not going fast enough.
elle attend un b b pour juin. , she is expecting a baby in june.
tu es si m chante. , you re so mean.
il a l esprit ouvert. , he s open minded.
je suis triste. , i m sad.
il ne se trouve pas en ville. , he s out of town.
vous tes chanceuse. , you re fortunate.
vous tes mignonnes dans votre genre. , you re kind of cute.
tu es la fois mignonne et gentille. , you are both pretty and kind.
il est mon ami. , he is my friend.
il est dou pour prendre des photos. , he is good at taking photos.
je ne suis pas ton ennemi. , i am not your enemy.
je suis dans mon appartement. , i m in my apartment.
il est un peu rev che. , he s a bit rough around the edges.
je t emm ne dans un endroit sympathique. , i m taking you somewhere nice.
j essaye de sortir d ici. , i m trying to get out of here.
c est toi la professeur. , you re the teacher.
tu n es pas si fou. , you re not that crazy.
je suis en col re apr s toi. , i m mad at you.
je vais le dire tout le monde. , i m going to tell everybody.
tu es l instituteur. , you re the teacher.
vous vous tes tromp d avion. , you are on the wrong plane.
je fais encore partie de cette famille. , i m still part of this family.
je suis mieux. , i am better.
il a plut t raison. , he is quite right.
il est son bureau. , he is at his office.
il est la recherche d un emploi. , he is looking for a job.
vous dites toujours a. , you re always saying that.
j ai d j termin. , i m already done.
vous tes fort compr hensive. , you re very understanding.
vous tes tr s curieux. , you re very curious.
elle est bonne en tennis. , she s good at tennis.
je suis en quelque sorte fatigu. , i m sort of tired.
je suis ravi de t avoir ici tom. , i m happy to have you here tom.
tu es tr s ing nieux. , you re very clever.
tu en fais partie. , you re part of this.
je suis en s curit. , i m safe.
je ne vais pas porter a. , i m not wearing this.
c est une femme d affaire succ s. , she s a successful businesswoman.
il est grand et fort. , he is tall and strong.
elle a deux ans de plus que vous. , she is two years older than you.
tu es tatillon. , you re finicky.
je vais cet endroit. , i am going to that place.
je ne suis pas scientifique. , i m not a scientist.
je vais tout fait bien maintenant. , i am quite all right now.
tu es tr s jolie. , you re very pretty.
je ne suis pas abrutie. , i m not dumb.
je ne suis pas bon l dedans. , i m not good at this.
il est tr s prudent. , he is very careful.
je suis cr atif. , i m creative.
je suis heureuse de t avoir invit. , i m glad i invited you.
tu compares des choux et des carottes! , you re comparing apples and oranges!
vous tes arrogant. , you re arrogant.
je suis enchant e d tre ici. , i m delighted to be here.
je suis toujours membre. , i m still a member.
je pars dimanche. , i m leaving on sunday.
vous faites un excellent travail. , you re doing an excellent job.
je vais tudier. , i am going to study.
tu es terriblement silencieux ce matin. , you re awfully quiet this morning.
je suis paresseuse. , i m lazy.
c est un retrait. , he s a senior.
je n en suis pas content. , i m not happy with this.
elle adore les g teaux. , she is fond of cake.
je vais en australie. , i m going to australia.
tu es inhabituellement calme aujourd hui. , you re unusually quiet today.
je verrai mon oncle demain. , i am seeing my uncle tomorrow.
il est sur le point de partir. , he s about to go.
il n est jamais satisfait. , he s never satisfied.
je suis celui qui a construit ceci. , i m the one who built this.
je vais hanovre avec toi. , i m going to hanover with you.
il joue dehors. , he is playing outdoors.
je dois dix mille dollars mon oncle. , i m in debt to my uncle for.
tu es matinale. , you re early.
tu te conduis de fa on trange. , you re acting weird.
il se fait vieux. , he is getting old.
elle lui a vol beaucoup d argent. , she stole a lot of money from him.
je tente de vous parler. , i m trying to talk to you.
vous tes un g nie. , you are a genius.
je suis en train de cuire du pain. , i am baking bread.
tu te plains toujours. , you re always complaining.
il est si distant. , he s such a cold fish.
vous tes rus s. , you re crafty.
je suis certain que tu r ussiras. , i m sure that you ll succeed.
elle est chan arde. , she is lucky.
je suis s re que tom le fera. , i m sure tom will do that.
vous tes tr s l gant. , you re very stylish.
elle est en retard. , she is late.
je suis votre plus grand fan. , i m your biggest fan.
elle est affair e. , she s busy with her work.
vous tes sans piti. , you re ruthless.
je ne sors pas avec tom. , i m not dating tom.
je suis fortun. , i m wealthy.
votre temps est coul. , you re out of time.
j en suis heureux. , i m happy with it.
je n ai pas faim non plus. , i m not hungry either.
je ne suis pas pay pour faire cela. , i m not paid to do that.
il est nerveux et facilement effray. , he s nervous and gets scared easily.
