je suis tr s endormi aujourd hui galement. , i m very sleepy today too.
je ne suis pas un expert. , i m no expert.
c est un homme jaloux. , he is a jealous man.
tu es l enseignant. , you re the teacher.
je me sens beaucoup mieux aujourd hui. , i m feeling much better today.
je suis certain qu il va venir. , i m sure he will come.
je m amuse vraiment. , i m actually enjoying myself.
il n est pas disponible. , he is not available.
je suis heureux de vous avoir engag s. , i m glad i hired you.
je suis habitu veiller tard. , i am accustomed to staying up late.
t es sympa. , you re cool.
la mauvaise personne c est moi. , i m the bad one.
il est jeune et en bonne sant. , he s young and healthy.
tu as de gros probl mes. , you re in big trouble.
j irai p cher avec lui. , i m going fishing with him.
elle est en col re apr s moi. , she is angry with me.
tu es gentille. , you re kind.
elle pr pare le d ner. , she is making dinner.
vous tes pleine de surprises. , you re full of surprises.
je s journe chez un ami. , i am staying with a friend.
vous tes juste l heure. , you re right on time.
tu es contrari e. , you re upset.
je suis contagieuse. , i m contagious.
tu es une disgr ce. , you re a disgrace.
tu es d go tante. , you re disgusting.
elle est tranquille. , she is quiet.
je suis si heureux. , i m so glad.
je ne suis pas convaincue. , i m unconvinced.
vous tes le chef. , you re the leader.
je suis professeur. , i am a professor.
je n en ai pas termin. , i m not finished.
je suis plus que content. , i m more than happy.
je suis la plus jeune enfant. , i m the youngest child.
il n est plus ce qu il tait. , he is not what he was.
je vais tre mari. , i m going to get married.
je suis en gr ve. , i m on strike.
tu es surqualifi e pour cet emploi. , you re overqualified for this job.
je vais faire des courses demain. , i m going shopping tomorrow.
tu es tellement idiote! , you re such an idiot!
je suis assez embrouill comme a. , i m confused enough as it is.
tu es incorrigible. , you re incorrigible.
vous tes cern es. , you re surrounded.
il est tokyo. , he is in tokyo.
je suis pr t partir maintenant. , i m ready to go now.
tu es confus. , you re confused.
c est un tudiant. , he is a student.
j ai bien peur qu il pleuve demain. , i m afraid it may rain tomorrow.
je ne vais pas m impliquer. , i am not getting involved.
je ne fais que commencer. , i m just beginning.
vous tes l lue. , you are the chosen one.
il est son ami. , he is her friend.
il n est vraiment pas fou. , he is not at all foolish.
tu es plus jolie que mary. , you re cuter than mary.
je suis ici pour vous aider. , i m here to help you.
je suis sur le point de quitter ici. , i am about to leave here.
elle est encore mineure. , she s still a minor.
je suis suffisamment fort. , i m strong enough.
vous n tes d aucune aide. , you re no help.
vous allez mourir. , you re going to die.
je viens d am rique. , i m from america.
tu m ennuies. , you re annoying.
c est une boule de nerfs. , he s a nervous wreck.
il parle couramment le fran ais. , he is fluent in french.
je suis toujours attach ce v lo. , i am still attached to this bicycle.
vous mentez n est ce pas? , you re lying aren t you?
je vais l abattre. , i m going to shoot him dead.
j en ai assez de l anglais. , i m fed up with english.
vous tes fort attirantes. , you re very attractive.
je suis le chirurgien. , i m the surgeon.
il craint de commettre des erreurs. , he is afraid of making mistakes.
tu es trop confiant. , you re too trusting.
je te suis reconnaissant pour ton aide. , i am grateful for your help.
je suis irrempla able. , i m irreplaceable.
je me r jouis que tout soit termin. , i m delighted that it s all over.
vous avez fini de travailler non? , you re done working aren t you?
je suis fatigu e de tout. , i m tired of everything.
je suis maintenant l a roport. , i m at the airport now.
vous tes plus intelligente que moi. , you re smarter than me.
tu es tr s curieux. , you re very curious.
je commence avoir sommeil. , i m getting sleepy.
je suis en quelque sorte fatigu e. , i m sort of tired.
j ai peur du noir. , i m afraid of the dark.
elle est encore mineure. , she is still a girl.
je suis un peu sceptique. , i m a little skeptical.
il est britannique. , he is british.
vous tes aveugl par l amour. , you are blinded by love.
je suis honn te avec vous. , i m being honest with you.
j ai encore soif. , i m still thirsty.
je suis intrigu e. , i m intrigued.
je suis enchant d tre ici. , i m delighted to be here.
je crains les animaux sauvages. , i m afraid of wild animals.
je suis volontaire. , i am a volunteer.
elle tala une belle nappe sur une table. , she spread a beautiful cloth on a table.
vous tes vraiment magnifique. , you re really gorgeous.
il est gaucher. , he s a southpaw.
vous tes tr s l gante. , you re very sophisticated.
vous tes matinal. , you are early.
je suis int ress par l histoire japonaise. , i am interested in japanese history.
elle a cinq ans. , she is five years old.
je ne suis qu un pauvre tudiant. , i m just a poor student.
je suis une actrice pas un mannequin. , i m an actress not a model.
il est auteur. , he s an author.
vous avez tous deux faux. , you are both in the wrong.
il est en faillite. , he is bankrupt.
vous avez de gros probl mes maintenant. , you re in big trouble now.
je suis effondr d entendre a. , i m very sorry to hear that.
quelle idiote vous tes! , you re such an idiot!
je suis fier de vous les gars. , i m proud of you guys.
t es plant e. , you re stuck.
il est capitaine de l quipe de football. , he is captain of the football team.
je me suis amend e. , i m reformed.
je suis puis. , i m exhausted.
vous tes redevable de la dette. , you are liable for the debt.
c est vraiment une fille adorable. , she is indeed a lovely girl.
je compte devenir ing nieur. , i am going to be an engineer.
il est trop confiant. , he s too trusting.
il est g n reux avec son argent. , he is generous with his money.
j ai le mal du pays. , i m homesick.
il va avoir une attaque cardiaque. , he s going to have a heart attack.
je ne suis pas ton professeur. , i m not your teacher.
vous tes fort solitaire. , you re very lonely.
vous tes presque aussi grand que tom. , you re almost as tall as tom.
tu es tr s curieuse. , you re very curious.
c est un bel homme. , he is a handsome man.
il est int ress par la musique. , he is interested in music.
vous n tes pas aussi petit que moi. , you aren t as short as i am.
il est non fumeur. , he s a nonsmoker.
je suis canadien moi aussi. , i m canadian too.
je ressens beaucoup d hostilit. , i m sensing a lot of hostility.
je vais cuisiner pour vous. , i m going to cook for you.
elle est l diteur en chef. , she is the executive editor.
vous tes allemands n est ce pas? , you re germans aren t you?
tu es fort dr le. , you re very funny.
il est encore au travail. , he s still at work.
il est plus vieux mais pas plus sage. , he s older but no wiser.
c est un lectron libre. , he s a loose cannon.
vous n tes pas laid. , you aren t ugly.
elle n est pas toujours heureuse. , she is not always happy.
elle lui a montr la photo. , she showed him the photo.
il est plus intelligent qu eux. , he s brighter than they are.
je ne suis simplement pas tr s occup. , i m just not very busy.
j ai du pot. , i m lucky.
il me poursuit. , he s after me.
j ai encore faim. , i m still hungry.
je cherche un bon h tel. , i am looking for a good hotel.
c est un bon joueur de tennis. , he is a good tennis player.
je suis toujours ton amie. , i m still your friend.
c est un grand l che. , he s a big coward.
j en suis vraiment fier. , i m really proud of it.
je suis l un d entre vous. , i m one of you.
il est impatient de s y rendre. , he is eager to go there.
je suis sobre. , i m sober.
je suis un peu mal l aise. , i m kind of uncomfortable.
c est un baratineur. , he s a smooth talker.
je suis fatigu e de danser. , i m tired of dancing.
tu n es pas tr s amusant. , you re not very funny.
elle est inconsciente. , she is unconscious.
tu es incroyablement na f. , you are unbelievably naive.
vous restez avec tom n est ce pas? , you re staying with tom right?
vous tes la plus vieille. , you re the oldest.
je mange. , i m eating.
tu es le meilleur pour ce travail. , you re the best man for the job.
il est parfait en tout. , he s perfect at everything.
j attends un appel. , i m expecting a call.
je ne suis pas assez bon pour toi. , i m not good enough for you.
tu es imprudente. , you re foolish.
je suis plus petit que vous. , i m shorter than you.
vous tes un bon gar on. , you are a good boy.
il parle anglais. , he is speaking english.
je suis le capitaine. , i m the captain.
c est un expert la fronde. , he s an expert with a slingshot.
je ne fais que mon travail. , i m just doing my job.
je suis d accord d accepter votre offre. , i m willing to accept your offer.
je vois quelqu un. , i m seeing someone.
vous tes grande. , you re big.
vous tes tr s curieuses. , you re very curious.
je ne suis pas tr s athl tique. , i m not very athletic.
il va me l expliquer. , he is going to explain it to me.
vous vous embrouillez nouveau non? , you re confused again aren t you?
vous n tes pas ma m re. , you aren t my mother.
je suis toujours votre ami. , i m still your friend.
vous tes une sale menteuse! , you re a filthy liar!
je suis votre c t. , i m by your side.
c est la fille de mes r ves. , she s the girl of my dreams.
j ai fini d enseigner. , i am done teaching.
je vais bien. , i m doing well.
tu es idiot. , you re being silly.
elle adore chanter de vieilles chansons. , she is fond of singing old songs.
je me pr pare au pire... , i m getting ready for the worst.
elle a une peur bleue des serpents. , she s very afraid of snakes.
il se cache dans le placard. , he s hiding in the closet.
c est un grand gar on. , he s a big boy.
je suis un moine. , i am a monk.
tu es trop confiante. , you re too trusting.
je maigris. , i m losing weight.
il n a jamais t amoureux auparavant. , he s never been in love before.
t es bourr. , you re smashed.
c est mon vieil ami. , he is my old friend.
j ai raison. , i am right.
elle est toujours en mouvement. , she s always on the go.
je vais tre papa. , i m going to be a father.
je suis tr s heureux de te voir. , i am very glad to see you.
je vais crire une lettre demain. , i am going to write a letter tomorrow.
tu manques de temps. , you re running short of time.
je suis contente que vous soyez l. , i m glad you could be here.
je suis assez fort pour faire a maintenant. , i m strong enough to do that now.
je suis s rieux. , i m serious.
je cherche ma cl. , i m looking for my key.
je suis trop occup pour aider tom. , i m too busy to help tom.
vous tes merveilleuses. , you re wonderful.
elle fait juste semblant. , she s just putting up a front.
je t autorise y aller. , i m allowing you to go.
vous tes tr s bonne. , you re very good.
vous tes chanceuse d avoir un travail. , you re lucky that you have a job.
je ne suis pas l aise ce sujet. , i m not comfortable with this.
je suis galement la pension. , i m retired too.
je commence penser que vous tes s rieux. , i m beginning to think you re serious.
elle crit des nouvelles. , she is a short story writer.
elle nous apprend le fran ais. , she s teaching us french.
c est un ancien. , he s a senior.
tu es tellement impatiente. , you re so impatient.
vous n tes pas comme les autres. , you aren t like the others.
elle est plus vieille que lui. , she s older than him.
vous tes dur. , you re tough.
tu n es pas un l che. , you are not a coward.
je lis un livre sur les animaux. , i am reading a book about animals.
je joue un jeu sur console. , i m playing a tv game.
je me r jouis que tu sois venue. , i m glad you came over.
je ne suis pas comme vous. , i m not like you.
elle est en retard sur son loyer. , she is behind in her rent.
tu es un pi tre menteur. , you re a bad liar.
je ne suis pas aussi riche que toi. , i m not as rich as you are.
je suis tellement perplexe. , i m so confused.
vous n tes pas seules. , you re not alone.
tu es immorale. , you re unethical.
c est une connaissance de ma femme. , he is acquainted with my wife.
tu as parfaitement raison. , you re completely right.
j ai peur des ours. , i am afraid of bears.
il part pour new york la semaine prochaine. , he is leaving for new york next week.
je suis fauch. , i m broke.
ce n est pas une menteuse. , she s not a liar.
je n y vais pas. , i m not going.
je ne suis amoureuse de personne. , i m not in love with anyone.
elle le gifla. , she slapped him.
c est un peintre. , he is a painter.
je ne suis pas pr te mourir. , i m not ready to die.
il est fier d tre m decin. , he is proud of being a doctor.
vous tes tr s directe. , you re very direct.
je vais partir une nuit plus t t. , i m going to leave one night early.
c est un homme sage. , he is a man of wisdom.
je ne le fais plus. , i m not doing this anymore.
vous tes celle qui a plant cet arbre. , you re the one who planted that tree.
je vais me baigner. , i m going to take a bath.
vous tes fantasque. , you re temperamental.
il est am ricain. , he is an american.
je dors peu. , i m a light sleeper.
vous tes tr s sages. , you re very wise.
je suis contre le travail du dimanche. , i am against working on sundays.
je ne vous drague pas. , i m not hitting on you.
elle creuse sa propre tombe. , she s digging her own grave.
il est en train de manger une pomme. , he s eating an apple.
il est frais moulu de l universit. , he s fresh out of college.
vous tes endormis. , you re sleepy.
vous n tes pas habill s. , you re not dressed.
j attends ton aide. , i m waiting for your help.
je suis tellement fi re de toi. , i m so proud of you.
je prends soin de mon grand p re. , i m taking care of my grandfather.
tu es probablement fatigu. , you re probably tired.
j apprends vite. , i m a fast learner.
je suis plut t contente. , i m fairly happy.
il n est pas vraiment minutieux. , he s not a very meticulous guy.
elle porte une robe verte. , she is in a green dress.
il est plus malin que moi. , he is more clever than me.
je suis galement occup e. , i m busy too.
tu es l a n. , you re the oldest.
je suis plus astucieux que vous. , i m smarter than you.
mon ordinateur portable tourne sous linux. , i m running linux on my laptop.
elle se prom ne parfois dans le parc. , she sometimes takes a walk in the park.
il lave sa voiture. , he is washing his car.
tu es l amour de ma vie. , you re the love of my life.
elle a sembl indiff rente. , she seemed uninterested.
tu es vilain. , you are naughty.
elle est une vrai beaut. , she is a real beauty.
il est d pendant la coca ne. , he is addicted to cocaine.
je suis le plus jeune enfant. , i m the youngest child.
je ne suis pas arm. , i m not armed.
il parle couramment le chinois. , he is fluent in chinese.
je ne suis pas seule. , i m not alone.
vous vous approchez. , you re getting closer.
je suis d pourvu d ambition. , i m unambitious.
je suis vous et vous tes moi. , i am yours and you are mine.
je suis d go t et d u. , i m disgusted and disappointed.
il est son c t. , he s at her side.
t es un super bon camarade. , you re a mighty good feller.
tu es trop polie. , you re too polite.
j en ai marre de vos plaintes. , i m getting tired of your complaints.
elle est gentille avec les personnes g es. , she is kind to old people.
vous n tes pas seul. , you re not alone.
je suis normal. , i m normal.
tu es en grave danger. , you re in serious danger.
je ne suis pas pr sentable. , i m not presentable.
elle chanta mieux que lui. , she sang better than him.
tu es trop suspicieuse de tout. , you re too suspicious about everything.
je suis consciente de mes responsabilit s. , i m aware of my responsibilities.
elle est impatiente de le revoir. , she is looking forward to seeing him again.
je suis votre d bitrice. , i am in your debt.
j essaie de comprendre. , i m trying to understand.
j ai du mal dormir. , i m having trouble sleeping.
je suis la seule avoir surv cu. , i m the only one who survived.
vous tes deux fois plus forte que moi. , you are twice as strong as i am.
vous tes des actrices. , you are actresses.
je ne suis pas ma place ici. , i m out of place here.
il est dot d une grande intelligence. , he s highly intelligent.
je pars ce soir. , i m leaving tonight.
tu es responsable de ce r sultat. , you are responsible for the result.
j en suis absolument certaine. , i m absolutely certain of it.
je ne panique pas. , i m not panicking.
j en suis consciente. , i m aware of that.
elle glissa son bras dans le sien. , she slipped her arm into his.
je suis enseignant en japonais. , i m a japanese teacher.
je ne suis pas v g tarien. , i m not a vegetarian.
je ne fais que blaguer. , i am only joking.
je vais me marier. , i m getting married.
c est une personne tr s attentionn e. , he is a very thoughtful person.
je suis surpris de l apprendre. , i am surprised to learn this.
je suis puis. , i am exhausted.
vous tes ambitieux. , you re ambitious.
t es un vrai th sauriseur. , you re such a pack rat.
j en ai fini. , i m done.
elle passa toute l apr s midi cuisiner. , she spent all afternoon cooking.
personne n est trop vieux pour apprendre. , you re never too old to learn.
je ne viens pas d une famille riche. , i m not from a rich family.
maintenant je suis tr s heureuse. , i m very happy now.
tu n y es pas en s curit. , you re not safe here.
c est une coriace. , she s a tough one.
elle n est qu une enfant. , she is just a child.
il est fort comme un cheval. , he s as strong as a horse.
il est dans la salle de bain. , he is in the bathroom.
je suis assez fier de cela. , i m pretty proud of that.
tu n es pas vraiment millionnaire si? , you re not really a millionaire are you?
vous mentez mal. , you re a bad liar.
je cherche un correspondant fran ais. , i m looking for a french penpal.
vous mentez. , you are lying.
je m entra ne pour le triathlon. , i m training for the triathlon.
vous tes tr s courageuse. , you are very brave.
tu n es pas malade. , you re not sick.
je suis fi re de ma famille. , i m proud of my family.
je suis aussi grand que toi. , i m as tall as you.
tu es idiote. , you re silly.
je suis juste un type normal. , i m just a normal guy.
tu es d sormais en s curit. , you re safe now.
j ai la frousse. , i m jittery.
je ne porte pas de chaussettes. , i m not wearing socks.
je suis triste sans toi. , i m sad without you.
vous tes incroyablement stupide. , you re unbelievably stupid.
vous tes responsable. , you are to blame.
tu n es qu un l che. , you re just a coward.
elle le poursuivit en justice. , she sued him.
je suis un citoyen am ricain. , i m an american citizen.
je suis r ticent aider tom. , i m reluctant to help tom.
c est un gentil gar on. , he s a sweet guy.
il se trouve juste derri re toi. , he s right behind you.
tu es gar en double file. , you re double parked.
je suis avec vous. , i m by your side.
je suis extr mement consciente du danger. , i m very much aware of the danger.
elle cherche un meilleur emploi. , she is after a better job.
tu n es pas japonais. , you are not japanese.
je pratique le judo. , i m practising judo.
je suis clou. , i m grounded.
je suis aussi curieuse que toi. , i m as curious as you are.
tu es tout fait attirante. , you re quite attractive.
vous tes en premier. , you re first.
il est impopulaire pour une raison quelconque. , he is unpopular for some reason.
vous tes fort timide. , you re very timid.
vous tes d sormais en s curit. , you re safe now.
elle l a touff avec un oreiller. , she suffocated him with a pillow.
il a des chances de gagner la partie. , he is likely to win the game.
j essaie de me rappeler. , i m trying to remember.
elle est capable de tout. , she is capable of anything.
elle lui tira dessus. , she shot him.
je suis un de vos employ s. , i m one of your employees.
tu es stupide. , you are stupid.
je suis contente que vous alliez nouveau bien. , i m glad you re ok again.
je suis heureuse que vous ayez r ussi. , i am glad that you have succeeded.
j ai froid. , i m cold.
je suis conscient des risques. , i m aware of the risks.
je suis nulle au tennis. , i m terrible at tennis.
il cherche plaire. , he is eager to please.
je suis heureux d entendre cela. , i m glad to hear that.
vous tes fort grossi res. , you re very rude.
il va s asseoir ici. , he s going to sit here.
il est ici pour moi. , he s here for me.
je suis ravi de faire votre connaissance. , i m glad to make your acquaintance.
je suis raisonnable. , i m not being unreasonable.
elle a tr s peur du noir. , she is very afraid of the dark.
je ne suis pas bon en math matiques. , i m not good at math.
il a soif de pouvoir. , he s hungry for power.
il est aristocrate. , he s an aristocrat.
je ne suis pas s r de comprendre. , i m not sure i understand.
en ce moment je n tudie pas. , i am not studying now.
je vais appeler la police. , i m going to call the police.
je ne suis pas si maligne. , i m not all that smart.
tu es bavard. , you re talkative.
je suis trop fatigu e pour me disputer. , i m too tired to argue.
elle l a sermonn pour son retard. , she scolded him for being late.
je plaisante bien s r. , i m joking of course.
vous tes suffisantes. , you re conceited.
elle n est pas chanteuse. , she s no singer.
vous tes fort l gante. , you re very sophisticated.
je descends au prochain arr t. , i m getting off at the next stop.
il est assez mignon non? , he s kind of cute isn t he?
je suis d sarm e. , i m powerless.
j ai peur des araign es. , i m afraid of spiders.
c est vous qui m avez form. , you re the one who trained me.
il a loup le coche. , he s missed the boat.
vous tes le seul me comprendre. , you re the only one who understands me.
il est une sorte de c l brit. , he is something of a celebrity.
je prends fran ais l ann e prochaine. , i am taking french next year.
vous tes le doyen. , you re the oldest.
vous tes tr s courageuse. , you re very brave.
je ne suis pas heureux dans mon travail. , i am not happy with my job.
vous tes parfois si pu rile. , you are so childish sometimes.
vous tes une de ces dragueuses! , you re such a flirt.
tu t embrouilles nouveau non? , you re confused again aren t you?
j en ai assez de ses excuses. , i m sick of her excuses.
vous portez toujours les m mes v tements. , you re always wearing the same clothes.
tu n es pas dr le. , you re no fun.
je ne la vendrai pas. , i m not going to sell it.
il est helv te. , he s swiss.
je suis heureuse de vous avoir invit s. , i m glad i invited you.
il va se faire virer. , he s going to get fired.
je regrette beaucoup mais je ne peux pas. , i m very sorry but i can t.
je suis daltonien. , i m color blind.
il est cool pas vrai? , he is cool isn t he?
je vais un concert ce soir. , i m going to a concert tonight.
vous tes contentes. , you re satisfied.
il est bord du bateau. , he is on board the ship.
vous n tes pas des leurs si? , you re not one of them are you?
je suis celui qui a peint ce tableau. , i m the one who painted this picture.
je suis une vraie loque. , i m a total wreck.
je suis trop gros. , i m too fat.
je suis motiv e. , i m motivated.
tu es la plus mignonne. , you re the sweetest.
je suis s re que tom viendra demain. , i m sure tom will come tomorrow.
vous tes arrogantes. , you re arrogant.
je suis content que a te rende heureuse. , i m glad that makes you happy.
il est toujours l heure un rendez vous. , he is always on time for an appointment.
je suis un citoyen du monde. , i m a citizen of the world.
il vous attend la maison. , he s waiting for you at home.
c est une amie moi. , she is a friend of mine.
il a environ trente ans. , he is about thirty.
j ai peur des chiens. , i m afraid of dogs.
j prouve du ressentiment. , i m resentful.
j en ai marre de ce jeu. , i m sick of this game.
je suis toi et tu es moi. , i am yours and you are mine.
vous tes fiable. , you re reliable.
j ai terriblement faim. , i am terribly hungry.
je suis encore ind cis. , i m still undecided.
tu es pr venant. , you re considerate.
il est accro aux m thamph tamines. , he s a meth addict.
je suis rationnelle. , i m rational.
tu es tr s g n reuse. , you re very generous.
je ne sais pas bien nager. , i m bad at swimming.
elle est partie en voyage. , she s gone on a trip.
je compte sur ton aide. , i m counting on your help.
je suis aussi choqu que vous. , i m as shocked as you are.
c est certainement une quadra. , she is certainly over forty.
j ai honte d avoir fait a. , i m ashamed that i did that.
il est connu de tous. , he is known to everyone.
il n est pas du tout honn te. , he is not honest at all.
je suis parfaitement heureux. , i m perfectly happy.
je suis juste ici. , i m right here.
je ne suis pas un proph te. , i am not a prophet.
je suis court d id es. , i m out of ideas.
je suis paum maintenant. , i m confused now.
tu te fais comprendre. , you re assertive.
c est un de ces pauvres types! , he s such a jerk.
pour une fois j ai raison. , i am right for once.
je ne suis pas un rebelle. , i m no rebel.
elle dit qu elle viendra. , she says she will come.
je ne suis pas en train de compter. , i m not counting.
c est une enfoir e. , she s a dog.
j ai plus d exp rience que tom. , i m more experienced than tom.
je n ai vraiment pas faim. , i m really not hungry.
elle est sympathique avec tout le monde. , she is gracious to everyone.
je ne me sens pas seul. , i m not lonely.
je n ai plus de souffle. , i m out of breath.
je suis en danger. , i m in danger.
il a la cinquantaine bien tass e. , he s in his late fifties.
je ne suis toujours pas impressionn. , i m still not impressed.
je suis aim de ma m re. , i am loved by my mother.
elle est tudiante. , she is a college student.
il est en train de dessiner une image. , he is drawing a picture.
elle a dit au revoir. , she said goodbye.
je suis pr t tout faire pour toi. , i am ready to do anything for you.
il n est pas vraiment un artiste. , he is not much of an artist.
elle parle haute voix. , she speaks loudly.
je suis pr te pour partir. , i m ready to go.
