j ai vraiment froid. , i m really cold.
il est employ de banque. , he is employed in a bank.
il est allong sur le canap. , he is lying on the sofa.
je n y suis pas int ress. , i m not interested in that.
il est aveugl par l amour. , he is blinded by love.
vous tes trop maigres. , you re too skinny.
vous tes avides. , you re greedy.
elle apprend jouer du piano. , she is learning the piano.
je suis impitoyable. , i m ruthless.
je suis la fille d un gentilhomme. , i am a gentleman s daughter.
tu es vraiment en mauvais tat. , you re really in bad shape.
tu es lib r de toute responsabilit. , you re free of all responsibility.
je ne vais pas encore abandonner. , i m not giving up yet.
j ai des pr jug s. , i m prejudiced.
tu es vraiment emb tante. , you are really annoying.
elle a perdu ses cl s de voiture. , she s lost her car keys.
je ne suis pas certain de cela. , i am not certain about that.
je sais bien cuisiner. , i m good at cooking.
vous tes givr s! , you re nuts!
je suis tr s petit. , i m very short.
je suis extr mement gras. , i m extremely fat.
tu me bloques la vue. , you re blocking my view.
je suis tellement embarrass e. , i m so embarrassed.
tu es un survivant. , you re a survivor.
tu es l lue. , you are the one.
tu es en train de perdre. , you re losing.
je suis toubib. , i m a doctor.
elle est bien plus heureuse que lui. , she s much happier than him.
vous tes saufs. , you re safe.
tu es exactement comme ton p re. , you re just like your father.
tu n es pas contrari e si? , you re not upset are you?
il a le cancer des poumons. , he s got lung cancer.
il n est pas japonais. , he is not japanese.
il est candidat au congr s. , he s running for congress.
j essaie simplement d tre amical. , i m just trying to be friendly.
je suis simplement en train de constater. , i m just stating the facts.
j en ai assez de cet endroit. , i m tired of this place.
je suis boston toute cette semaine. , i m in boston all this week.
vous ne trompez personne. , you re not fooling anybody.
je rigole! , i m joking.
je suis tr s occup aujourd hui. , i m very busy today.
il est encore f ch. , he is still angry.
je me r jouis d entendre votre voix. , i am happy to hear your voice.
je vais regarder la t l ce soir. , i am going to watch tv this evening.
il est aussi g que mon p re. , he is as old as my father.
il n est pas en ville. , he s out of town.
il se sent beaucoup mieux. , he s feeling much better.
ce n est pas mon cousin. , he s not my cousin.
il n est pas l int rieur. , he s not in.
j attends de toi un travail s rieux. , i am expecting some serious work from you.
je suis habitu tom maintenant. , i m used to tom now.
c est mon meilleur ami. , he is my best friend.
c est un bizuth. , he s a freshman.
je suis fier de mon fr re. , i m proud of my brother.
je vais travailler dur. , i m going to work hard.
tu es allemand n est ce pas? , you re german right?
j ai tr s faim. , i am very hungry.
je suis mari maintenant. , i m married now.
j en suis s re et certaine! , i m absolutely sure!
je reste avec mon oncle. , i m staying with my uncle.
vous n tes pas une sainte. , you re no saint.
je suis plus d gourdie que toi. , i m smarter than you.
tu es talentueuse. , you re talented.
je suis pr te! , i m ready!
vous l emportez. , you re winning.
elle se leva. , she stood up.
c est moi le patron. , i m the boss.
vous tes belles. , you re beautiful.
je ne parle pas avec toi. , i m not talking to you.
il est maintenant court d argent. , he s now short of money.
je vais tre ton avocat. , i m going to be your lawyer.
je vais bien. , i am okay.
je ne fais pas partie de leurs admirateurs. , i m not a fan.
t es remont e. , you re psyched.
c est vous qui m avez form e. , you re the one who trained me.
je m occupe de mon grand p re. , i m taking care of my grandfather.
tu es fort l gant. , you re very stylish.
je ne suis pas patiente. , i m not patient.
vous tes si m chants. , you re so mean.
il est joueur. , he s a gambler.
vous tes tellement impatients. , you re so impatient.
je suis tout coup fatigu e. , i m suddenly tired.
je suis si fi re de mon quipe. , i m so proud of my team.
tu es suffisant. , you re conceited.
je sors un moment. , i m going out for a while.
vous tes l enseignant. , you re the teacher.
vous commencez me faire peur. , you re starting to scare me.
il n est jamais paresseux. , he is never lazy.
il est l pour te prot ger. , he s here to protect you.
j y suis habitu. , i m accustomed to this.
vous tes vraiment incroyables. , you re really incredible.
je suis ton partenaire. , i m your partner.
tu es terriblement silencieux aujourd hui. , you re awfully quiet today.
tu fais d sormais partie de la bande. , you re part of the gang now.
c est un pauvre type. , he s a jerk.
je suis r ellement d sol. , i am truly sorry.
vous n tes pas mourant. , you re not dying.
je viens de russie. , i am from russia.
il viendra me voir demain apr s midi. , he is coming to see me tomorrow afternoon.
je suis dingue de football. , i m crazy about football.
je me cache. , i m hiding.
il n est pas l non? , he isn t here is he?
je suis mouill e. , i m wet.
je suis tellement d sol! , i m so sorry.
je suis tr s satisfait de mon achat. , i m very happy with my purchase.
elle est gracieuse. , she is graceful.
je m habitue ce temps. , i m getting used to this weather.
je ne blague pas. , i m not kidding.
on attend de vous que vous les aidiez. , you re required to help them.
je suis calme. , i m calm.
je pars maintenant. , i m going.
vous tes pleine de ressources. , you re very resourceful.
tu es un opportuniste. , you re opportunistic.
elle est toute cousue d or. , she s rolling in money.
vous n tes pas mon amie. , you re not my friend.
je suis c libataire. , i m unmarried.
il plaisante toujours. , he is always joking.
je ne suis personne de particulier. , i m no one special.
elle l a vu briser la fen tre. , she saw him break the window.
j ai faim! , i m hungry!
il a peur de son ombre. , he is afraid of his own shadow.
tu frissonnes. tu as froid? , you re shivering. are you cold?
c est le gar on le plus grand. , he is the tallest boy.
c est un beau parleur. , he s a smooth talker.
je ne suis pas ton fils. , i m not your son.
il est reporter pour le time. , he is a reporter for time magazine.
il porte une chemise de coton blanc. , he s wearing a white cotton shirt.
c est un jeune homme prometteur. , he is a promising young man.
je mangerai une p che. , i m going to eat a peach.
fais ce qu il te pla t. , you are welcome to do anything you like.
j ai honte de votre conduite. , i am ashamed of your conduct.
vous tes rus es. , you re crafty.
je t offre un travail. , i m offering you a job.
je ne suis pas particuli rement soucieux. , i m not particularly worried.
je ne suis pas vraiment occup e. , i m not really busy.
elle trouve toujours des d fauts son mari. , she is always finding fault with her husband.
il n est pas un saint. , he s no saint.
tu as fini de travailler non? , you re done working aren t you?
vous n tes pas fatigu s si? , you re not tired are you?
vous tes fascinante. , you re fascinating.
ma m re m aime. , i am loved by my mother.
vous tes cruelles. , you re cruel.
elle est priv e de sortie. , she is forbidden to go out.
il est petit mais fort. , he is short but strong.
vous ne m coutez pas. , you re not listening to me.
tu es bon. , you re good.
vous tes vraiment emb tants. , you re really annoying.
je suis fain ante. , i m lazy.
il parle fran ais couramment. , he is fluent in french.
vous n tes pas contrari si? , you re not upset are you?
je suis trop vieille pour vous. , i m too old for you.
elle est assez f ch e. , she is quite angry.
vous tes fort bonnes. , you re very good.
j ai peur des chauves souris. , i m afraid of bats.
je suis s r qu ils vont gagner. , i m sure they ll win.
il est content de sa vie simple. , he is content with the simple life.
tu m ennuies. , you re boring.
il est trop lent. , he s too slow.
je ne suis pas enseignant. , i m not a teacher.
je vais t enseigner un peu de karat. , i m going to teach you some karate.
vous tes blanc comme un drap. , you are as white as a sheet.
je suis rapide. , i m fast.
elle est incapable de faire face la tension. , she is unable to cope with stress.
je suis trop jeune pour faire a. , i m too young to do that.
elle est d j mari e. , she is already married.
vous tes une chanteuse pouvantable. , you re a horrible singer.
vous tes seul n est ce pas? , you re alone aren t you?
il est instituteur. , he is a teacher.
je suis minutieuse. , i m thorough.
je n essaie d impressionner personne. , i m not trying to impress anyone.
elle est au r gime. , she is on a diet.
il est dj. , he is a dj.
je suis dans la maison. , i m at home.
je vais appeler la police. , i m going to go call the police.
tu n es plus la bienvenue ici. , you are no longer welcome here.
tu es calme. , you re quiet.
je pars ce soir pour l australie. , i m leaving tonight for australia.
je suis plus vive que vous. , i m smarter than you.
j en ai assez de tes r criminations. , i m sick of your complaints.
je fais mes devoirs. , i m doing my homework.
tu es l lue. , you are the chosen one.
je ne suis pas ton amie. , i m not your friend.
je suis encore occup e. , i m still busy.
vous chantez tout le temps. , you re always singing.
tu es trop poli. , you re too polite.
elle est assise sur le banc. , she s sitting on the bench.
elle le sermonna pour son retard. , she scolded him for being late.
je pars la semaine prochaine. , i am leaving next week.
vous tes d loyal. , you re disloyal.
je ne suis pas facilement impressionn e. , i m not easily impressed.
vous tes idiote. , you re being silly.
tu es si gentille! , you re so sweet.
je ne suis pas aux pi ces. , i m not in a rush.
je suis trop fatigu pour me disputer. , i m too tired to argue.
vous tes trop polie. , you re too polite.
il ne s en va pas. , he s not going.
je suis un homme libre. , i m a free man.
il est connu pour tre un grand peintre. , he is known as a great painter.
qu on ne me d range pas! , i m not to be disturbed.
je vais l tranger cet t. , i am going abroad this summer.
je ne suis pas vieille. , i m not old.
elle est occup e pr parer le voyage. , she is busy preparing for the trip.
tu es curieux hein? , you are curious aren t you?
tu es contagieuse. , you re contagious.
tu ne regardes pas tout le paysage. , you re not looking at the whole picture.
je vais me laver les mains. , i m going to go wash my hands.
vous tes plant s. , you re stuck.
je ne me plains pas. , i m not complaining.
je ne suis plus un b b! , i m not a baby you know!
je suis heureuse que vous veniez. , i m glad you re coming.
je suis s re que tom tait impliqu. , i m sure tom was involved.
je ne vais pas travailler. , i m not going to work.
c est vous le ma tre. , you re the master.
vous tes suffisante. , you re conceited.
il n est pas autoris quitter le pays. , he s not allowed to leave the country.
je suis en train d plucher des pommes. , i am peeling apples.
vous tes tr s contrari. , you re very upset.
vous tes cens s faire a. , you re supposed to do that.
tu es plus grand que moi. , you are taller than me.
je suis toujours heureux. , i m always happy.
je vous vire. , i m letting you go.
tu es importante. , you are important.
je suis surpris. , i m surprised.
c est une fille s duisante. , she s a glamorous girl.
elle saute la corde. , she is skipping rope.
je cherche mon fr re. , i m searching for my brother.
je vais lire un peu. , i m going to do some reading.
il est connu de tous. , he is known to everybody.
vous tes connus. , you re famous.
tu es toujours vivante. , you re still alive.
je suis d sol propos de hier soir. , i m sorry about last night.
je ne suis pas m decin mais enseignant. , i am not a doctor but a teacher.
tu es tr s sceptique. , you re very skeptical.
il est la hauteur de la t che. , he is equal to the job.
c est une tr s chouette fille. , she s a very nice girl.
tu es trop sensible la critique. , you are too sensitive to criticism.
il va mieux. , he is getting better.
je suis vraiment d sol e. , i am truly sorry.
vous tes libre de vous en aller. , you re free to go.
vous tes tr s grossi re. , you re very rude.
il a trop confiance en lui m me. , he s overconfident.
je suis mari e. , i am married.
vous travaillez dur. , you re working hard.
elle a l air triste. , she seems sad.
je suis content de te voir ici. , i m glad to see you here.
je suis trop occup pour l aider. , i m too busy to help her.
il est fort grand. , he is very tall.
il marche en direction de la gare. , he is walking towards the station.
je m ennuie juste un peu. , i m just a little bored.
je ne suis plus inspir e. , i m not inspired anymore.
tu es timide. , you re shy.
je suis heureux que vous veniez. , i m glad you re coming.
je ne suis pas ton ennemi. , i m not your enemy.
il est tout sauf mort. , he is all but dead.
tu gaspilles du temps. , you re wasting time.
il a peur des serpents. , he is afraid of snakes.
je suis libre jusqu heures ce soir. , i am free till o clock this evening.
vous tes un sacr menteur. , you re such a liar.
je ne blague pas. , i am not kidding.
il n est pas mari. , he s not married.
il est encore plein d nergie. , he is still full of energy.
elle est sortie pour des chaussures. , she s out shopping for shoes.
vous tes le bouc missaire. , you re the scapegoat.
je suis tr s attir e par toi. , i m very drawn to you.
me voil satisfaite. , i m contented.
tu es mon meilleur client. , you re my best customer.
il perd tout le temps son parapluie. , he is always losing his umbrella.
je suis habitu e travailler dur. , i am accustomed to working hard.
elle ne devrait pas s y rendre seule. , she shouldn t go by herself.
il est photographe professionnel. , he s a professional photographer.
je suis responsable de cette erreur. , i am responsible for the mistake.
je ne suis qu un enfant. , i m just a child.
je ne vais pas rentrer la maison. , i m not coming back home.
c est une puissante sorci re. , she s a powerful witch.
tu es compl tement ignorante. , you re totally ignorant.
je suis toujours tr s nerveux. , i m always very nervous.
il est rouill. , he s out of practice.
vous tes lib r de toute responsabilit. , you re free of all responsibility.
je manque d espace dans ma penderie. , i m running out of closet space.
je suis s re que c est faux. , i m sure that s wrong.
je ne vais pas me laisser impliquer. , i m not going to get involved.
tu es tr s vive. , you re very sharp.
je suis votre chef. , i m your boss.
je suis maigrichonne. , i m skinny.
tu es tr s occup. , you re very busy.
il est d sesp r ment amoureux. , he s hopelessly in love.
je ne suis s re de rien. , i m not sure of anything.
c est un homme aux multiples talents. , he s a man of many talents.
je suis perplexe. , i m baffled.
vous tes un homme bon. , you re a good man.
je suis une de vos employ es. , i m one of your employees.
je perds patience avec toi. , i am losing my patience with you.
je crains d avoir de mauvaises nouvelles. , i m afraid i ve got bad news.
j ai honte de mon pass. , i m ashamed of my past.
je vis en ville. , i m living in the city.
je crains d avoir du travail faire. , i m afraid i have work to do.
j en ai marre de ce temps. , i m fed up with this weather.
tu es un sale menteur! , you re a filthy liar!
je m amuse. , i m having fun.
c est une bonne joueuse de tennis. , she is a good tennis player.
je suis pr te pour demain. , i m ready for tomorrow.
elle devrait y tre midi. , she should be there at noon.
je suis content d avoir pu aider. , i m glad i could help out.
c est un vrai mec. , he s a real man.
je n en ai pas fini avec toi. , i m not finished with you.
je me meurs. , i m dying.
j ai raison. , i m correct.
elle dit qu elle aime les fleurs. , she says that she likes flowers.
a colle pour moi. , i m fine with it.
je suis capable de faire mes propres choix. , i m capable of making my own decisions.
tu es mince. , you re thin.
tu imagines des choses. , you re imagining things.
j appr hende l examen. , i m dreading the exam.
je suis surprise que tom ait gagn. , i m surprised tom won.
elle est dure la t che. , she is very hardworking.
il est maladroit de ses mains. , he is clumsy with his hands.
je me remets. , i m getting better.
je perds du poids. , i m losing weight.
elle est hors de danger. , she is out of danger.
je sors cet apr s midi. , i am going out this afternoon.
je suis s rieuse. , i m not bluffing.
il est plus fort que vous. , he s stronger than you.
on m utilise. , i m being used.
il est d tective. , he is a detective.
tu es excus. , you re forgiven.
je vaux mieux que a. , i m worth more than this.
il est venu pour causer des ennuis. , he s come to make trouble.
vous n tes pas cens s nager ici. , you aren t supposed to swim here.
tu analyses trop. , you re over analyzing.
vous tes go stes. , you re selfish.
je suis apr s lui. , i am after him.
je vais avoir quatorze ans. , i am going to be fourteen.
je suis excit. , i m excited.
il t attend chez lui. , he s waiting for you at home.
vous avez raison cent pour cent. , you re a hundred percent right.
elle est la s ur de tom. , she s tom s sister.
en ce moment je manque de liquidit s. , i m short of cash at the moment.
je suis un chauffeur de camion. , i m a truck driver.
il est plus rus que sage. , he is more crafty than wise.
elle est au premier rang. , she is first in line.
je vais avoir besoin de davantage de temps. , i m going to need some more time.
il est po te. , he is a poet.
je ne suis pas saoul ce point. , i m not all that drunk.
je ne suis pas le patron. , i m not the boss.
elle est bien plus lourde que lui. , she s much heavier than him.
tu es suffisamment vieux pour savoir a. , you are old enough to know this.
je rencontre quelqu un pour d ner. , i m meeting someone for dinner.
il n est pas plus fort que moi. , he s not stronger than me.
elle est toujours soigneusement v tue. , she is always neatly dressed.
je d sesp re de te voir! , i m dying to see you.
il m aide. , he s helping me.
vous conduisez comme un tar! , you re driving like a maniac!
je suis curieux. , i am curious.
c est une personne de confiance. , she is a reliable person.
j en ai marre de ce temps humide. , i am fed up with this wet weather.
je suis fort impressionn. , i m very impressed.
c est une femme d int rieur accomplie. , she s the perfect housewife.
tu es un de ces idiots! , you re such an idiot!
j ai tr s honte de moi. , i m very ashamed of myself.
elle est toujours pre au travail. , she is always hard at work.
je suis d sol. , i am sorry.
il aime l aventure. , he is fond of adventure.
tu as toujours te plaindre. , you are always complaining.
vous tes inquiets n est ce pas? , you re worried aren t you?
vous tes bavardes. , you re talkative.
vous en avez d j fini. , you re finished already.
je suis innocent. , i m an innocent man.
tu me fais marcher! , you re kidding!
il est l pour moi. , he s here for me.
je suis reconnaissant envers mes amis. , i m thankful for my friends.
je suis content de t aider. , i am glad to help you.
tu es trop maigrichonne. , you re too skinny.
je suis en vacances cette semaine. , i am on holiday this week.
je suis la seule qui comprend tom. , i m the only one who understands tom.
elle dort avec deux coussins. , she sleeps with two pillows.
vous n tes pas si int ressantes. , you re not that interesting.
je pense vous. , i m thinking about you.
on ne veut pas de toi ici. , you re not wanted here.
il vit s par de sa femme. , he is living apart from his wife.
je ne vais pas vous faire de mal. , i m not going to hurt you.
elle est mari e un tranger. , she s married to a foreigner.
je suis fatigu e d tre malade. , i m tired of being sick.
je suis de votre c t. , i m on your side.
je vais me marier. , i m going to get married.
il est nouveau en ville. , he s new in town.
je suis au ch mage. , i m unemployed.
je suis tr s triste d entendre cela. , i m very sad to hear that.
je ne suis pas patient. , i m not patient.
je suis vraiment dangereux. , i am very dangerous.
j ai honte d avoir fait cela. , i m ashamed that i did that.
tu es charmant. , you re charming.
je vais faire un feu. , i m going to build a fire.
c est l une de mes amies. , she is one of my friends.
je travaille pour une entreprise de commerce. , i m working for a trading firm.
c est un gar on intelligent. , he is a clever boy.
je suis sienne et elle est mienne. , i am hers and she is mine.
tu n es pas indispensable. , you re replaceable.
c est moi la patronne par ici. , i m the boss around here.
vous tes amoureux. , you re in love.
je vais travailler. , i m going to work.
vous n tes pas vir e. , you re not fired.
il est si jeune. , he s so young.
je suis court d nergie. , i m running out of energy.
tu es fort sceptique. , you re very skeptical.
je ne suis pas un chanteur. , i m not a singer.
je te fais une faveur. , i m doing you a favor.
tu es recherch e par la police. , you re wanted by the police.
tu r agis de mani re excessive. , you re overreacting.
je vieillis. , i m getting old.
je suis le chef de cette quipe. , i am the leader of this team.
vous tes tr s talentueux. , you re very talented.
vous tes tr s sages. , you re very smart.
je ne suis pas un de vos soldats. , i m not one of your soldiers.
elle est folle. , she s demented.
elle a honte de ses vieux v tements. , she is ashamed of her old clothes.
je suis ravi d tre ici. , i am delighted to be here.
je cuisine. , i m cooking.
tu es mon type. , you re my type.
il est probable qu il remporte la partie. , he is likely to win the game.
elle a plus de livres. , she s got more books.
tu es tr s talentueux. , you re very talented.
tu ne risques rien. , you re quite safe.
c est un brave homme. , he is a brave man.
j y suis accoutum. , i m used to it.
je suis vraiment occup l instant. , i m really busy right now.
il gagne plein de thune. , he s raking it in.
je vais acheter une nouvelle voiture. , i am going to buy a new car.
j en ai vraiment marre de cette chaleur. , i m really fed up with this heat.
elle vit actuellement l tranger. , she is living abroad.
tu n es pas coh rent. , you are not consistent.
il est fou de ski. , he is crazy about skiing.
je ne suis pas votre servante. , i m not your maid.
je suis d pourvue de talent. , i m untalented.
vous tes fort l gantes. , you re very stylish.
je suis quasiment pr te. , i am almost ready.
je commence la d tester. , i m beginning to hate her.
je ne vais pas jouer ce jeu. , i m not going to play this game.
j ai peur de l obscurit. , i m afraid of the dark.
j attends un coup de fil. , i m expecting a call.
elle tricote un pull. , she is knitting a sweater.
tu es grande. , you are big.
vous tes toutes satisfaites. , you re all happy.
vous allez vous remettre. , you re going to be ok.
tu es tr s ouvert. , you re very open.
il est connu comme un grand peintre. , he is known as a great painter.
j en ai marre de penser. , i m done thinking.
elle est en train de manger des fruits. , she s eating fruit.
j ai repris le business. , i m back in business.
il est un peu m ch. , he s a bit tipsy.
il se trompe compl tement. , he is sadly mistaken.
vous tes surmen e. , you re overworked.
il est un peu jaloux. , he s a bit jealous.
je suis le seul qui comprenne. , i m the only one who understands.
ce n est pas toi qui dirige. , you re not in charge.
je ne vais pas manger ceci. , i m not going to eat this.
je suis en premier. , i m first.
il est innocent. , he s innocent.
vous me d cevez. , i m disappointed in you.
je fais mes devoirs. , i am doing my homework.
j ai trop sommeil pour conduire. , i m too sleepy to drive.
je suis sur le chemin du travail. , i m on my way to work.
il a trois ans de plus que moi. , he s three years older than me.
tu es tr s observatrice. , you re very observant.
je suis chanceux d avoir un travail. , i m lucky to have a job.
je suis flasque. , i m flabby.
j arrive tout de suite. , i m coming at once.
vous tes trop lents. , you re too slow.
c est un enfant g t. , he is a spoiled child.
je suis un agent. , i m an agent.
je suis contente que vous soyez l. , i m glad you re here.
elle est tr s mauvaise cuisini re. , she is terrible at cooking.
ce n est pas une enfant. , she s not a child.
c est un pigiste. , he s a freelance journalist.
je ne suis pas content. , i am not happy.
je me sens confus. , i m feeling confused.
c est un avocat comp tent. , he is a capable lawyer.
vous n tes pas diff rent. , you re no different.
je suis respectueux. , i m observant.
tu es ent t e. , you re stubborn.
il n est pas chez lui. , he s not in.
je suis ici en tant que touriste. , i m here as a tourist.
tu es terre terre. , you re grounded.
il n est pas toujours heureux. , he s not always happy.
je suis du m me ge. , i am the same age.
vous tes chanceux. , you re fortunate.
je suis le second de trois enfants. , i m the middle child of three.
je suis tr s d sorient. , i m all confused.
je vais te blesser. , i m going to hurt you.
je ne suis pas bon a. , i m not good at it.
je suis allong dans l herbe. , i m lying on the grass.
elle est tr s sage. , she is very wise.
vous ne me soutenez pas beaucoup. , you re not being very supportive.
vous tes trop lentes. , you re too slow.
c est vraiment un bon travailleur. , he is a really good worker.
vous tes la chef. , you re the leader.
il est trop occup. , he s too busy.
je suis terriblement fatigu. , i m extremely tired.
je suis d sol d avoir dit cela. , i m sorry i said that.
je ne fais pas ceci pour moi. , i m not doing this for me.
je suis heureuse que tu viennes. , i m glad you re coming.
vous tes impressionn es n est ce pas? , you re impressed aren t you?
je suis toute vous. , i m all yours.
tu es splendide. , you are gorgeous.
je suis comme ma m re. , i am like my mother.
tu es chanceuse d avoir un travail. , you re lucky that you have a job.
je suis r ellement fi re de toi. , i m really proud of you.
je suis content que a te rende heureux. , i m glad that makes you happy.
